{
  "id": "tech-blog",
  "name": "Technology Blog",
  "url": "http://automated-content-pipeline-local-test-site.local",
  "username": "admin",
  "appPassword": "odNl IaCt 3OYb o4I7 W3sK zGw7",
  "topics": [
    "artificial intelligence",
    "programming",
    "software development",
    "cybersecurity",
    "web development",
    "mobile development",
    "data science",
    "machine learning",
    "cloud computing",
    "devops",
    "blockchain",
    "tech news",
    "coding tutorials",
    "tech reviews",
    "startup technology"
  ],
  "categories": [
    "Artificial Intelligence",
    "Programming",
    "Software Development",
    "Cybersecurity",
    "Web Development",
    "Mobile Development",
    "Data Science",
    "Machine Learning",
    "Cloud Computing",
    "DevOps"
  ],
  "tags": [
    "tech",
    "programming",
    "ai",
    "development",
    "cybersecurity",
    "web-dev",
    "mobile-dev",
    "data-science",
    "machine-learning",
    "cloud",
    "devops",
    "blockchain",
    "tutorial",
    "review",
    "startup"
  ],
  "status": "active",
  "description": "Technology blog focused on programming, AI, software development, and tech innovation",
  "lastUpdated": "2025-01-27T00:00:00Z"
}
